{
  "schema_version": "1.0",
  "sample": {
    "sha256": "0202553cca2144d89f77092d7b5c5a775a4a3ff46541e178e3044902fcd6ff2f",
    "md5": "f8f66658c3b52ae3df30c1af620ff4c2",
    "sha1": "785088c95d8ae98b85cbad6a8cb69b845209d224",
    "size": 14400,
    "format": "elf",
    "arch": "x86",
    "bits": 64
  },
  "verdict": {
    "classification": "suspicious",
    "confidence": "low",
    "risk": "low"
  },
  "summary": "Stripped binary with 1 function(s) that XOR-decode data at runtime. The routine at 0x1149 with key 0x5a recovers 'http://c2.example.invalid/gate.php' from 0x2020, called from 0x11cf. Network-related imports: none observed.",
  "behaviors": [
    {
      "behavior": "Runtime decoding of an obfuscated string (single-byte XOR)",
      "function": "0x1149",
      "attack_id": "T1140",
      "confidence": "medium",
      "evidence": [
        "0x1149 contains a loop with a non-zeroing XOR (renamed xor_decode_routine)",
        "xor_bruteforce at 0x2020: key 0x5a -> 'http://c2.example.invalid/gate.php'",
        "caller 0x11cf references 0x2020 and calls 0x1149"
      ]
    }
  ],
  "obfuscation": [
    "single-byte XOR string encoding (key 0x5a)"
  ],
  "limitations": [
    "Produced by the offline heuristic policy (not a language model): it only recognizes single-byte XOR decode loops. No finding does not mean benign.",
    "Static analysis only; nothing was executed and no network lookups were made.",
    "Pseudo-code fidelity is low; conclusions rely on disassembly and decoded bytes."
  ],
  "recommendations": [
    "Validate the decoded indicator against threat intelligence before blocking.",
    "Run with an LLM backend (--llm openai) to characterize the rest of the program."
  ],
  "iocs": [
    {
      "type": "url",
      "value": "http://c2.example.invalid/gate.php",
      "context": "decoded with key 0x5a from data at 0x2020",
      "grounded": true
    },
    {
      "type": "domain",
      "value": "c2.example.invalid",
      "context": "decoded with key 0x5a from data at 0x2020",
      "grounded": true
    }
  ],
  "analysis": {
    "tool": "retriage 0.1.0",
    "backend": "radare2",
    "llm": "heuristic-offline-policy",
    "steps": 17,
    "tool_calls": 17,
    "renamed_functions": [
      {
        "address": "0x1149",
        "old_name": "fcn.00001149",
        "new_name": "xor_decode_routine"
      }
    ],
    "ungrounded_iocs": []
  }
}
